root@lamp-s-1vcpu-1gb-tor1-01:~# tcpdump -n -i eth0
tcpdump: verbose output suppressed, use -v or -vv for full protocol decode
listening on eth0, link-type EN10MB (Ethernet), capture size 262144 bytes
20:40:24.565635 IP 167.99.182.133.22 > 99.252.4.178.57824: Flags [P.], seq 2031531203:2031531311, ack 1846226752, win 890, length 108
20:40:24.565744 IP 167.99.182.133.22 > 99.252.4.178.57824: Flags [P.], seq 108:144, ack 1, win 890, length 36
20:40:24.565857 IP 167.99.182.133.22 > 99.252.4.178.57824: Flags [P.], seq 144:252, ack 1, win 890, length 108
20:40:24.565936 IP 167.99.182.133.22 > 99.252.4.178.57824: Flags [P.], seq 252:288, ack 1, win 890, length 36
20:40:24.566247 IP 167.99.182.133.22 > 99.252.4.178.57824: Flags [P.], seq 288:460, ack 1, win 890, length 172
20:40:24.566340 IP 167.99.182.133.22 > 99.252.4.178.57824: Flags [P.], seq 460:496, ack 1, win 890, length 36
20:40:24.566456 IP 167.99.182.133.22 > 99.252.4.178.57824: Flags [P.], seq 496:644, ack 1, win 890, length 148
20:40:24.566533 IP 167.99.182.133.22 > 99.252.4.178.57824: Flags [P.], seq 644:680, ack 1, win 890, length 36
20:40:24.566634 IP 167.99.182.133.22 > 99.252.4.178.57824: Flags [P.], seq 680:828, ack 1, win 890, length 148
20:40:24.578948 IP 99.252.4.178.57824 > 167.99.182.133.22: Flags [.], ack 828, win 4117, length 0
20:40:24.579012 IP 167.99.182.133.22 > 99.252.4.178.57824: Flags [P.], seq 828:1968, ack 1, win 890, length 1140
20:40:24.579332 IP 167.99.182.133.22 > 99.252.4.178.57824: Flags [P.], seq 1968:2100, ack 1, win 890, length 132
20:40:24.579429 IP 167.99.182.133.22 > 99.252.4.178.57824: Flags [P.], seq 2100:2136, ack 1, win 890, length 36
20:40:24.579536 IP 167.99.182.133.22 > 99.252.4.178.57824: Flags [P.], seq 2136:2284, ack 1, win 890, length 148
20:40:24.579615 IP 167.99.182.133.22 > 99.252.4.178.57824: Flags [P.], seq 2284:2320, ack 1, win 890, length 36
20:40:24.579715 IP 167.99.182.133.22 > 99.252.4.178.57824: Flags [P.], seq 2320:2468, ack 1, win 890, length 148
20:40:24.579828 IP 167.99.182.133.22 > 99.252.4.178.57824: Flags [P.], seq 2468:2504, ack 1, win 890, length 36
20:40:24.579931 IP 167.99.182.133.22 > 99.252.4.178.57824: Flags [P.], seq 2504:2652, ack 1, win 890, length 148
20:40:24.580013 IP 167.99.182.133.22 > 99.252.4.178.57824: Flags [P.], seq 2652:2688, ack 1, win 890, length 36
20:40:24.580116 IP 167.99.182.133.22 > 99.252.4.178.57824: Flags [P.], seq 2688:2836, ack 1, win 890, length 148
20:40:24.580289 IP 167.99.182.133.22 > 99.252.4.178.57824: Flags [P.], seq 2872:3020, ack 1, win 890, length 148
20:40:24.580462 IP 167.99.182.133.22 > 99.252.4.178.57824: Flags [P.], seq 3056:3204, ack 1, win 890, length 148
20:40:24.580635 IP 167.99.182.133.22 > 99.252.4.178.57824: Flags [P.], seq 3240:3388, ack 1, win 890, length 148
20:40:24.580808 IP 167.99.182.133.22 > 99.252.4.178.57824: Flags [P.], seq 3424:3572, ack 1, win 890, length 148
20:40:24.580982 IP 167.99.182.133.22 > 99.252.4.178.57824: Flags [P.], seq 3608:3756, ack 1, win 890, length 148
20:40:24.595686 IP 99.252.4.178.57824 > 167.99.182.133.22: Flags [.], ack 3756, win 4117, length 0
20:40:24.595766 IP 167.99.182.133.22 > 99.252.4.178.57824: Flags [P.], seq 3756:4896, ack 1, win 890, length 1140
20:40:24.595987 IP 167.99.182.133.22 > 99.252.4.178.57824: Flags [P.], seq 4896:5028, ack 1, win 890, length 132
20:40:24.596120 IP 167.99.182.133.22 > 99.252.4.178.57824: Flags [P.], seq 5028:5064, ack 1, win 890, length 36
20:40:24.596237 IP 167.99.182.133.22 > 99.252.4.178.57824: Flags [P.], seq 5064:5212, ack 1, win 890, length 148
20:40:24.596315 IP 167.99.182.133.22 > 99.252.4.178.57824: Flags [P.], seq 5212:5248, ack 1, win 890, length 36
20:40:24.596414 IP 167.99.182.133.22 > 99.252.4.178.57824: Flags [P.], seq 5248:5396, ack 1, win 890, length 148
20:40:24.596489 IP 167.99.182.133.22 > 99.252.4.178.57824: Flags [P.], seq 5396:5432, ack 1, win 890, length 36
20:40:24.596587 IP 167.99.182.133.22 > 99.252.4.178.57824: Flags [P.], seq 5432:5580, ack 1, win 890, length 148
20:40:24.596664 IP 167.99.182.133.22 > 99.252.4.178.57824: Flags [P.], seq 5580:5616, ack 1, win 890, length 36
20:40:24.596789 IP 167.99.182.133.22 > 99.252.4.178.57824: Flags [P.], seq 5616:5764, ack 1, win 890, length 148
20:40:24.596986 IP 167.99.182.133.22 > 99.252.4.178.57824: Flags [P.], seq 5800:5948, ack 1, win 890, length 148
20:40:24.597162 IP 167.99.182.133.22 > 99.252.4.178.57824: Flags [P.], seq 5984:6132, ack 1, win 890, length 148
20:40:24.597336 IP 167.99.182.133.22 > 99.252.4.178.57824: Flags [P.], seq 6168:6316, ack 1, win 890, length 148
20:40:24.597583 IP 167.99.182.133.22 > 99.252.4.178.57824: Flags [P.], seq 6352:6500, ack 1, win 890, length 148
20:40:24.597762 IP 167.99.182.133.22 > 99.252.4.178.57824: Flags [P.], seq 6536:6684, ack 1, win 890, length 148
20:40:24.597961 IP 167.99.182.133.22 > 99.252.4.178.57824: Flags [P.], seq 6720:6988, ack 1, win 890, length 268
20:40:24.598140 IP 167.99.182.133.22 > 99.252.4.178.57824: Flags [P.], seq 6988:7592, ack 1, win 890, length 604
20:40:24.598277 IP 167.99.182.133.22 > 99.252.4.178.57824: Flags [P.], seq 7592:7748, ack 1, win 890, length 156
20:40:24.598395 IP 167.99.182.133.22 > 99.252.4.178.57824: Flags [P.], seq 7748:7896, ack 1, win 890, length 148
20:40:24.598508 IP 167.99.182.133.22 > 99.252.4.178.57824: Flags [P.], seq 7896:8044, ack 1, win 890, length 148
20:40:24.598618 IP 167.99.182.133.22 > 99.252.4.178.57824: Flags [P.], seq 8044:8192, ack 1, win 890, length 148
20:40:24.598728 IP 167.99.182.133.22 > 99.252.4.178.57824: Flags [P.], seq 8192:8340, ack 1, win 890, length 148
20:40:24.598906 IP 167.99.182.133.22 > 99.252.4.178.57824: Flags [P.], seq 8340:8488, ack 1, win 890, length 148
20:40:24.599030 IP 167.99.182.133.22 > 99.252.4.178.57824: Flags [P.], seq 8488:8636, ack 1, win 890, length 148
20:40:24.599143 IP 167.99.182.133.22 > 99.252.4.178.57824: Flags [P.], seq 8636:8784, ack 1, win 890, length 148
20:40:24.599253 IP 167.99.182.133.22 > 99.252.4.178.57824: Flags [P.], seq 8784:8932, ack 1, win 890, length 148
20:40:24.599366 IP 167.99.182.133.22 > 99.252.4.178.57824: Flags [P.], seq 8932:9080, ack 1, win 890, length 148
20:40:24.599477 IP 167.99.182.133.22 > 99.252.4.178.57824: Flags [P.], seq 9080:9228, ack 1, win 890, length 148
20:40:24.599587 IP 167.99.182.133.22 > 99.252.4.178.57824: Flags [P.], seq 9228:9376, ack 1, win 890, length 148
20:40:24.599698 IP 167.99.182.133.22 > 99.252.4.178.57824: Flags [P.], seq 9376:9524, ack 1, win 890, length 148
20:40:24.599858 IP 167.99.182.133.22 > 99.252.4.178.57824: Flags [P.], seq 9524:9672, ack 1, win 890, length 148
20:40:24.599976 IP 167.99.182.133.22 > 99.252.4.178.57824: Flags [P.], seq 9672:9820, ack 1, win 890, length 148
20:40:24.600090 IP 167.99.182.133.22 > 99.252.4.178.57824: Flags [P.], seq 9820:9968, ack 1, win 890, length 148
20:40:24.600202 IP 167.99.182.133.22 > 99.252.4.178.57824: Flags [P.], seq 9968:10116, ack 1, win 890, length 148
...
20:40:24.740728 IP 99.252.4.178.57824 > 167.99.182.133.22: Flags [.], ack 139400, win 4117, length 0
20:40:24.740757 IP 99.252.4.178.57824 > 167.99.182.133.22: Flags [.], ack 141896, win 4117, length 0
20:40:24.740771 IP 99.252.4.178.57824 > 167.99.182.133.22: Flags [.], ack 142520, win 4115, length 0
20:40:24.740780 IP 99.252.4.178.57824 > 167.99.182.133.22: Flags [P.], seq 73:109, ack 142520, win 4115, length 36
20:40:24.740787 IP 99.252.4.178.57824 > 167.99.182.133.22: Flags [.], ack 146152, win 4117, length 0
1084 packets captured
1096 packets received by filter
12 packets dropped by kernel
